{"bundle_id":"bundle_c8a64f3578b5e5f77195a73c68d40c6f","bundle_sha256":"3665464fb8dbd15881fc0072b60eb362cf51d5b1abc0be45776df55e47efcf84","completeness":"INCOMPLETE","contract_version":"0.1","created_at":"2026-09-21T23:00:22Z","entries":[{"entry_id":"entry_9df5085de53fa403ef8d7d2033a79bbe","not_applicable_reason":"not supplied by this local candidate bundle","presence":"NOT_APPLICABLE","role":"environment_evidence"},{"entry_id":"entry_6871cbc3e467228638feef8197620685","not_applicable_reason":"not supplied by this local candidate bundle","presence":"NOT_APPLICABLE","role":"privacy_record"},{"entry_id":"entry_73c909048703d81f1da7a79b07f70864","not_applicable_reason":"not supplied by this local candidate bundle","presence":"NOT_APPLICABLE","role":"review_attestation"},{"entry_id":"entry_4d5321ef6bbcb8bcb76660b735bde3d6","not_applicable_reason":"not supplied by this local candidate bundle","presence":"NOT_APPLICABLE","role":"seal_attestation"},{"byte_length":119,"entry_id":"entry_b1f24407d7d424f746119389d18b53a8","path":".gitattributes","presence":"PRESENT","role":"not_applicable","sha256":"af9628ffcdc8d0a49ddf5edcb2dfdaa9b17713318d4b05d6b3a8bf08286b036d"},{"byte_length":9894,"entry_id":"entry_280f81bcd1547f3421f711a689a4071e","path":".github/workflows/pmiri.yml","presence":"PRESENT","role":"not_applicable","sha256":"7cac79ab37e4d5b14bdc78238d65dca0ae1a5c646f6973d69e397d15ec2bc1ab"},{"byte_length":828,"entry_id":"entry_d1dc76f80b58881bcb94cba88242285d","path":".gitignore","presence":"PRESENT","role":"not_applicable","sha256":"4bb1e30c1e0055ef8457f0cfe1f3cd11ffbc5809875840f26df75701a517cd13"},{"byte_length":6293,"entry_id":"entry_44382a5d034a3c2b434169d051d9dbe2","path":"EXTERNAL_CLOSURE_CHECKLIST.md","presence":"PRESENT","role":"not_applicable","sha256":"1a6d545008b2f391dd1b660c298ec53064e70df27dd6337bf0189390596270ad"},{"byte_length":14709,"entry_id":"entry_554069d319ccd74b3ba05a9d3231e7d3","path":"IMPLEMENTATION_PLAN.md","presence":"PRESENT","role":"not_applicable","sha256":"5879bedff92dc3d9df55ecdeaccdb14346cd95ed2fe37edc7ec7636fd1ba1c34"},{"byte_length":33444,"entry_id":"entry_0336a099f6aa3c96d6c2c0703c28cb59","path":"IMPLEMENTATION_STATUS.md","presence":"PRESENT","role":"not_applicable","sha256":"a95170eefe60cc4a29789d3efcfabd92c234781c371c39d3d621978e13c0bfcc"},{"byte_length":16312,"entry_id":"entry_6d78ab1b525f160d0905f9e054dfef79","path":"OPERATIONS_RUNBOOK.md","presence":"PRESENT","role":"not_applicable","sha256":"361395aad802c4b8472dd8ca2c4c6a315e74aee06fb2f4fa8b5cf37c98a57a58"},{"byte_length":5091,"entry_id":"entry_de7a36514b73b341ae48c78e29ff87c3","path":"PMIRI_ALL_DOCUMENTATION_CHECKPOINT_17/ARCHIVE_SOURCES/PMIRI_v0.9.1_Gate_C_Final_Cross_Round_Audit.zip","presence":"PRESENT","role":"not_applicable","sha256":"24585b2de427d6b1d7e5f29a95a77e9c065cd37b523b55ce67cadc126af8c533"},{"byte_length":11724,"entry_id":"entry_dee9a0303103fc0d02efee59016879c9","path":"PMIRI_ALL_DOCUMENTATION_CHECKPOINT_17/ARCHIVE_SOURCES/PMIRI_v1.0_Gate_C_Accepted.zip","presence":"PRESENT","role":"not_applicable","sha256":"4b9057d38f3058e3c558af10034a2fbe918bcea5ebf1512f0afa40cea8a24aa7"},{"byte_length":10830,"entry_id":"entry_4c4daafcd74734fc4fdc75f50a0a42f0","path":"PMIRI_ALL_DOCUMENTATION_CHECKPOINT_17/ARCHIVE_SOURCES/PMIRI_v1.1.1_Gate_D_R1_Accepted.zip","presence":"PRESENT","role":"not_applicable","sha256":"b4ea8dab0ad0dccb1e2a6b03cc99c8be7c0f5fe9f431db38f65a6c8f71466fbc"},{"byte_length":347,"entry_id":"entry_83442ad168d5789b85c6fe1a731d58d0","path":"PMIRI_ALL_DOCUMENTATION_CHECKPOINT_17/ARCHIVE_SOURCES/PMIRI_v1.1.1_Gate_D_R1_Accepted/00_DOCUMENTATION_AUTHORITY.md","presence":"PRESENT","role":"not_applicable","sha256":"a780878c583b1af1500aa6b679316ae1b95c35bd1bf40f2b77fc2b18233dff44"},{"byte_length":1431,"entry_id":"entry_9f666a2bc1e39a9368e39930898cf971","path":"PMIRI_ALL_DOCUMENTATION_CHECKPOINT_17/ARCHIVE_SOURCES/PMIRI_v1.1.1_Gate_D_R1_Accepted/01_AUTHORIZATION_SUBJECT_DELEGATION_AND_TRUST_ZONE.md","presence":"PRESENT","role":"not_applicable","sha256":"4bfebaaf6ee530c4c05c44368a82d7ff4ea759f20d043d5b3ef3d4d77d128983"},{"byte_length":1335,"entry_id":"entry_c57f3b8773535aba8e346a24527c1a3f","path":"PMIRI_ALL_DOCUMENTATION_CHECKPOINT_17/ARCHIVE_SOURCES/PMIRI_v1.1.1_Gate_D_R1_Accepted/02_SECURITY_CLASSIFICATION_BINDING_AND_CHANGE.md","presence":"PRESENT","role":"not_applicable","sha256":"b51181b2869eab072cb995ccd7ccd7046768237d7e26b6cffc1397037aa878aa"},{"byte_length":1138,"entry_id":"entry_7a4bc4baf8707a59605a3bb56baf7a15","path":"PMIRI_ALL_DOCUMENTATION_CHECKPOINT_17/ARCHIVE_SOURCES/PMIRI_v1.1.1_Gate_D_R1_Accepted/03_SECURITY_COMPOSITION_AND_DERIVED_SENSITIVITY.md","presence":"PRESENT","role":"not_applicable","sha256":"5030007c37ab4f30a1f91612944614e26b1635402ee0eb7813b558c593203d0e"},{"byte_length":1234,"entry_id":"entry_b78e71d5758950c86be7a86904b1f1dd","path":"PMIRI_ALL_DOCUMENTATION_CHECKPOINT_17/ARCHIVE_SOURCES/PMIRI_v1.1.1_Gate_D_R1_Accepted/04_REQUEST_AUTHORIZATION_AND_SECURITY_DECISION_VALIDITY.md","presence":"PRESENT","role":"not_applicable","sha256":"b02e2bedafa2e92451f6787ea9b07818006aabf571850abc98f2c92b417bc78a"},{"byte_length":1045,"entry_id":"entry_636e650d81b2746878a49c3b52209c71","path":"PMIRI_ALL_DOCUMENTATION_CHECKPOINT_17/ARCHIVE_SOURCES/PMIRI_v1.1.1_Gate_D_R1_Accepted/05_RESOURCE_ACCESS_AND_DISCLOSURE_POLICY.md","presence":"PRESENT","role":"not_applicable","sha256":"8e36def75b33eaed70f8759b4a7d26bb3c03a8344633a3f6e1f229627fee0a55"},{"byte_length":1427,"entry_id":"entry_5b3b70cb11f68e3d9241569cea3012d3","path":"PMIRI_ALL_DOCUMENTATION_CHECKPOINT_17/ARCHIVE_SOURCES/PMIRI_v1.1.1_Gate_D_R1_Accepted/06_DESTINATION_SECURITY_AND_EGRESS_DECISION.md","presence":"PRESENT","role":"not_applicable","sha256":"bdeb567d7dc79d4972d409b6bc4eabe50647d58959a5f5f9954aa0cdc0e9f93a"},{"byte_length":741,"entry_id":"entry_51221acff8361f881e572a6e2e1942c0","path":"PMIRI_ALL_DOCUMENTATION_CHECKPOINT_17/ARCHIVE_SOURCES/PMIRI_v1.1.1_Gate_D_R1_Accepted/07_POLICY_DECISION_ENFORCEMENT_AND_CACHE_RULES.md","presence":"PRESENT","role":"not_applicable","sha256":"290397edb8c29893d46143e4d9fffe4c06989173e797ee66e6126c8e6b81117c"},{"byte_length":1500,"entry_id":"entry_a2c9cc936e2a590239a4f660e578e37e","path":"PMIRI_ALL_DOCUMENTATION_CHECKPOINT_17/ARCHIVE_SOURCES/PMIRI_v1.1.1_Gate_D_R1_Accepted/08_GATE_D_R1_DECISION_REGISTER.md","presence":"PRESENT","role":"not_applicable","sha256":"5acda8362ce160a2ca0a7672cbd6e4b725c7d5432eda5febc600b2b67b6da948"},{"byte_length":1744,"entry_id":"entry_78e535e41418089146ff43cbfa962bc6","path":"PMIRI_ALL_DOCUMENTATION_CHECKPOINT_17/ARCHIVE_SOURCES/PMIRI_v1.1.1_Gate_D_R1_Accepted/09_GATE_D_R1_RECHECK_REPORT.md","presence":"PRESENT","role":"not_applicable","sha256":"6298a72ee517dc6cd059f080a826633d94c431894719499f506f0d33f4b8ecf6"},{"byte_length":812,"entry_id":"entry_cacde901afa9a994391acc9702ad1988","path":"PMIRI_ALL_DOCUMENTATION_CHECKPOINT_17/ARCHIVE_SOURCES/PMIRI_v1.1.1_Gate_D_R1_Accepted/10_RESEARCH_EVIDENCE.md","presence":"PRESENT","role":"not_applicable","sha256":"059d40fe9ac555abe058127574fa845d22e7615acc2359085afb5cf27eba2d1b"},{"byte_length":1099,"entry_id":"entry_b1180885119e1127d5da2010b3cf3155","path":"PMIRI_ALL_DOCUMENTATION_CHECKPOINT_17/ARCHIVE_SOURCES/PMIRI_v1.1.1_Gate_D_R1_Accepted/11_GATE_D_R2_ENTRY_CONTRACT.md","presence":"PRESENT","role":"not_applicable","sha256":"008760925d21fba6d8a5c247aded567d8888aeb0ebdd40b7316580f5660aa66e"},{"byte_length":825,"entry_id":"entry_cf68e3a492b8aea6cfb66c3f4f12e10a","path":"PMIRI_ALL_DOCUMENTATION_CHECKPOINT_17/ARCHIVE_SOURCES/PMIRI_v1.1.1_Gate_D_R1_Accepted/12_CHANGELOG.md","presence":"PRESENT","role":"not_applicable","sha256":"bc872bbacb05cec84889afd5301f66506562ed95a8c3d4681e33a472612c6f12"},{"byte_length":308,"entry_id":"entry_3fcad586c19fb622d4d24bc7e532b595","path":"PMIRI_ALL_DOCUMENTATION_CHECKPOINT_17/ARCHIVE_SOURCES/PMIRI_v1.1.1_Gate_D_R1_Accepted/README.md","presence":"PRESENT","role":"not_applicable","sha256":"b7a1424d9d848d5df2f8ec44b91016e2502b16d4f116ce6162edcb0954683d80"},{"byte_length":4122,"entry_id":"entry_9b1526eddd1b45f9d9a93a00270d3647","path":"PMIRI_ALL_DOCUMENTATION_CHECKPOINT_17/CHECKPOINTS/PMIRI_GC-C1_CHECKPOINT_01_COMPLETE_DOCUMENTATION_v0.1.md","presence":"PRESENT","role":"not_applicable","sha256":"4fd096db179625b1510ddd02ca62926eed50885e072aab0e62a9506feba47ee2"},{"byte_length":50741,"entry_id":"entry_68242829eb2f4e7604aee286a21fb3c9","path":"PMIRI_ALL_DOCUMENTATION_CHECKPOINT_17/CHECKPOINTS/PMIRI_GC-C1_CHECKPOINT_01_COMPLETE_DOCUMENTATION_v0.1.zip","presence":"PRESENT","role":"not_applicable","sha256":"56c6efecbd9cd83c983a65244378185861fa3b5c431270a38c6e0c9410a58fc0"},{"byte_length":2350,"entry_id":"entry_43af36a7553485fa70e8b66164c20acf","path":"PMIRI_ALL_DOCUMENTATION_CHECKPOINT_17/CHECKPOINTS/PMIRI_GC-C1_CHECKPOINT_02_COMPLETE_DOCUMENTATION_v0.1.md","presence":"PRESENT","role":"not_applicable","sha256":"087df3917efff11b99b61786eadc842170f853c72ddafa4434fe350efdfb20ec"},{"byte_length":39829,"entry_id":"entry_fb316a148cb8ed238725d7221d8bdeff","path":"PMIRI_ALL_DOCUMENTATION_CHECKPOINT_17/CHECKPOINTS/PMIRI_GC-C1_CHECKPOINT_02_COMPLETE_DOCUMENTATION_v0.1.zip","presence":"PRESENT","role":"not_applicable","sha256":"647c53bac591d920a72918c0e629523f0c98f9893d82356468d8188b0adbe0c5"},{"byte_length":23183,"entry_id":"entry_6ad7e1f7102ab987f044301d575ad4da","path":"PMIRI_ALL_DOCUMENTATION_CHECKPOINT_17/CHECKSUMS_SHA256.txt","presence":"PRESENT","role":"not_applicable","sha256":"ac6db8b921b648b5611463c3ac5b9c018775ed6373080b4e2b3343910d315c35"},{"byte_length":2529,"entry_id":"entry_e4dddc96c716b6ab4c99474518feedf2","path":"PMIRI_ALL_DOCUMENTATION_CHECKPOINT_17/GATE-D-R2/PMIRI_GD-R2-01_CONNECTOR_CREDENTIAL_BOUNDARY.schema.json","presence":"PRESENT","role":"not_applicable","sha256":"ee883dfa33258c0b693f8a77b2332dc24c23b8540d94b22c27e4122ff4020492"},{"byte_length":8966,"entry_id":"entry_62892d2f0a2e71a64f4b485a824864fd","path":"PMIRI_ALL_DOCUMENTATION_CHECKPOINT_17/GATE-D-R2/PMIRI_GD-R2-01_PROVIDER_CONNECTOR_TRUST_REGISTRY_CONTRACT_v0.1.md","